{
  "schema_version": "1.0.0",
  "catalog_id": "actools-contract-catalog-1.0.0",
  "profile": "single-site-production",
  "json_schema_dialect": "https://json-schema.org/draft/2020-12/schema",
  "canonicalization": "RFC8785",
  "action_vocabulary": [
    "host.initialize",
    "host.prepare",
    "deployment.install",
    "configuration.publish",
    "credentials.rotate",
    "service.restart",
    "caddy.reload",
    "maintenance.transition",
    "application.operator",
    "storage.probe",
    "notification.probe",
    "backup.capture",
    "backup.verify",
    "backup.maintain",
    "recovery.rehearse",
    "recovery.restore",
    "recovery.promote",
    "deployment.update",
    "deployment.rollback",
    "management.update",
    "diagnostics.probe",
    "operation.reconcile"
  ],
  "diagnostic_formats": ["human", "json", "markdown", "html"],
  "safe_next_actions": [
    {"action_id": "collect.evidence", "documentation_id": "docs:status-and-evidence", "source": "contract-catalog"},
    {"action_id": "consult.runbook", "documentation_id": "docs:installed-runbooks", "source": "contract-catalog"},
    {"action_id": "inspect.operation", "documentation_id": "docs:operation-inspection", "source": "contract-catalog"},
    {"action_id": "reconcile.operation", "documentation_id": "docs:operation-reconciliation", "source": "contract-catalog"},
    {"action_id": "request.authority", "documentation_id": "docs:authority-boundaries", "source": "contract-catalog"},
    {"action_id": "resolve.coverage", "documentation_id": "docs:status-and-evidence", "source": "contract-catalog"},
    {"action_id": "retry.delivery", "documentation_id": "docs:result-delivery", "source": "contract-catalog"},
    {"action_id": "review.plan", "documentation_id": "docs:plan-review", "source": "contract-catalog"}
  ],
  "contracts": [
    {
      "family": "configuration",
      "owner": "operator-input",
      "schema_version": "1.0.0",
      "schema_resource": "configuration-1.0.0.schema.json",
      "policy_resource": null,
      "reader_versions": ["1.0.0"],
      "writer_version": "1.0.0",
      "migration_edges": [],
      "field_groups": ["identity", "profile", "platform", "capabilities", "host-access", "drupal-storage-cache", "recovery-policy", "monitoring-notifications", "secret-references", "policy-release-references", "default-origins"],
      "artifact_boundary": "operator-input",
      "mutation_authority": "operator-explicit-output"
    },
    {
      "family": "plan",
      "owner": "planner",
      "schema_version": "1.0.0",
      "schema_resource": "plan-1.0.0.schema.json",
      "policy_resource": null,
      "reader_versions": ["1.0.0"],
      "writer_version": "1.0.0",
      "migration_edges": [],
      "field_groups": ["identity", "action-request", "actor-authority", "protected-resources", "target", "fingerprints-generations", "validity", "context-digests", "capabilities", "effects", "disruption", "pre-postconditions", "recovery", "irreversible-boundaries", "review-identity"],
      "artifact_boundary": "generated-artifact",
      "mutation_authority": "operator-explicit-output"
    },
    {
      "family": "operation-journal",
      "owner": "protected-engine",
      "schema_version": "1.0.0",
      "schema_resource": "operation-journal-1.0.0.schema.json",
      "policy_resource": null,
      "reader_versions": ["1.0.0"],
      "writer_version": "1.0.0",
      "migration_edges": [],
      "field_groups": ["operation-plan-effects", "state", "authenticated-actor", "protected-targets", "locks", "generations", "intent-attempts-deadlines", "handler", "postconditions", "evidence-errors", "reconciliation", "cleanup"],
      "artifact_boundary": "protected-store",
      "mutation_authority": "protected-writer"
    },
    {
      "family": "requirement-graph",
      "owner": "reviewed-release-source",
      "schema_version": "1.0.0",
      "schema_resource": "requirement-graph-1.0.0.schema.json",
      "policy_resource": "requirement-graph-1.0.0.json",
      "reader_versions": ["1.0.0"],
      "writer_version": "1.0.0",
      "migration_edges": [],
      "field_groups": ["stable-identity", "parent-feature", "provenance", "decision-status", "implementation-status", "advertised-support", "runtime-evidence", "applicability", "ownership", "dependencies", "refinement-supersession", "test-mapping", "contract-mapping"],
      "artifact_boundary": "release-resource",
      "mutation_authority": "release-process"
    },
    {
      "family": "release-manifest",
      "owner": "release-process",
      "schema_version": "1.0.0",
      "schema_resource": "release-manifest-1.0.0.schema.json",
      "policy_resource": null,
      "reader_versions": ["1.0.0"],
      "writer_version": "1.0.0",
      "migration_edges": [],
      "field_groups": ["release-source", "artifact-digests", "dependencies-licenses-sbom", "platform-profile", "contract-compatibility", "version-edges", "graph-configuration-digests", "security-floor", "verification", "qualification-receipts"],
      "artifact_boundary": "release-resource",
      "mutation_authority": "release-process"
    },
    {
      "family": "diagnostic-evidence",
      "owner": "collector-evaluator",
      "schema_version": "1.0.0",
      "schema_resource": "diagnostic-evidence-1.0.0.schema.json",
      "policy_resource": null,
      "reader_versions": ["1.0.0"],
      "writer_version": "1.0.0",
      "migration_edges": [],
      "field_groups": ["run-target-host-boot", "collector-context", "captured-evaluated-validity", "findings", "run-state", "selected-coverage", "required-policy-coverage", "gates", "attempts", "artifacts", "effects-cleanup", "provenance-trust"],
      "artifact_boundary": "generated-artifact",
      "mutation_authority": "protected-writer"
    },
    {
      "family": "backup-set",
      "owner": "trusted-recovery-service",
      "schema_version": "1.0.0",
      "schema_resource": "backup-set-1.0.0.schema.json",
      "policy_resource": null,
      "reader_versions": ["1.0.0"],
      "writer_version": "1.0.0",
      "migration_edges": [],
      "field_groups": ["set-source", "capture-consistency", "release-configuration", "constituents", "repository-snapshot", "encryption-key-identity", "history-pitr-coverage", "constituent-receipts", "verification", "commit", "retention", "restore-proof"],
      "artifact_boundary": "protected-store",
      "mutation_authority": "protected-writer"
    },
    {
      "family": "command-result",
      "owner": "command-engine",
      "schema_version": "1.0.0",
      "schema_resource": "command-result-1.0.0.schema.json",
      "policy_resource": null,
      "reader_versions": ["1.0.0"],
      "writer_version": "1.0.0",
      "migration_edges": [],
      "field_groups": ["command-run-target", "run-state-outcome", "timestamps", "typed-result", "durable-operation-outcome", "delivery-result", "errors-evidence", "owned-next-actions", "presentation-metadata"],
      "artifact_boundary": "result-envelope",
      "mutation_authority": "none"
    },
    {
      "family": "contract-catalog",
      "owner": "release-process",
      "schema_version": "1.0.0",
      "schema_resource": "contract-catalog-1.0.0.schema.json",
      "policy_resource": "contract-catalog-1.0.0.json",
      "reader_versions": ["1.0.0"],
      "writer_version": "1.0.0",
      "migration_edges": [],
      "field_groups": ["versions", "owners", "schemas-policies", "reader-writer-matrix", "migration-edges", "field-ownership", "actions-formats", "safe-next-actions"],
      "artifact_boundary": "release-resource",
      "mutation_authority": "release-process"
    }
  ]
}
